,product_name,product_desc,product_type,product_rating,num_reviews,customizations,metadata
https://www.saatva.com/bedding/organic-percale-duvet-cover-set,Organic Percale Duvet Cover Set,Crisp and cool organic cotton duvet cover and shams,bedding,,0,"{'duvet+covers_king_percale': 365, 'duvet+covers_king_organic+cotton': 365, 'duvet+covers_queen_percale': 315, 'duvet+covers_queen_organic+cotton': 315, 'duvet+covers_full_percale': 315, 'duvet+covers_full_organic+cotton': 315, 'duvet+covers_twin_percale': 235, 'duvet+covers_twin_organic+cotton': 235, 'duvet+covers_cal+king_percale': 365, 'duvet+covers_cal+king_organic+cotton': 365, 'duvet+covers_twin+xl_percale': 235, 'duvet+covers_twin+xl_organic+cotton': 235}","{'product_info': 'Organic Percale Duvet Cover Set\nCrisp and cool organic cotton duvet cover and shams\nWe’re the best reviewed sleep brand since 2010\n$165\nSELECT SIZE\nSize guide\nQTY\nSelect Size\n[object Object]\n[object Object]\n[object Object]\nTwin/Twin XL\n$165\nFull/Queen\nKing/Cal King\n$215\nSelect Quantity\n1\n2\n3\n4\n5\n1\n4\n5\nSELECT COLOR\nWhite\nAdd Extra Organic Percale Sham Pair\nInstantly give your bed a dose of cozy-casual luxury with our organic cotton duvet cover and matching shams. Its crisp and cool 200-thread count percale weave gets softer with every wash.\n100% GOTS certified organic cotton\nIncludes one duvet cover and two pillow shams\nTwin and Twin XL sets include one pillow sham\n1” flanged edge detail for a clean look\nHidden zipper closure on the duvet cover and center envelope opening on shams\nCorner ties keep your comforter/duvet insert (sold separately) in place.\nMachine wash cold with like colors, gentle cycle, no bleach, tumble dry low\nCertifications\nThis item is currently out of stock.\nSign up to be notified by email once it comes back\nin stock or call us at 1-877-672-2882\nEmail me when in stock\n\nBed Bonanza\nBIG Bedroom Bonanza Sale! 3 DAYS ONLY | Save up to $600 | Ends 8/3 | Learn More\n45-day free returns\nLearn More\nFree shipping\nLearn More\n1-year limited warranty\nLearn More', 'fabric_info': ""What makes our percale duvet cover sets so special?\nLIGHT YET DURABLE\nLong organic cotton fibers are woven into a percale weave to give you a crisp and clean finish, like your favorite dress shirt, but better.\nJUST THE RIGHT THREAD COUNT\nWe chose a thread count of 200 for the perfect balance of softness and breathability. Our organic percale cotton is pre-washed for a soft, lived-in feel.\nMADE WITH FAIR TRADE\nOur bedding is made in Fair Trade Certified™ factories with the most rigorous standards of economic and social responsibility for their workers. We believe it's the most effective way for us to do the most good every day.\nORGANIC ALL THE WAY\nWe only use GOTS (Global Organic Textile Standard) certified organic long-staple cotton. It's naturally breathable and hypoallergenic, so it's not only better for the planet, it's better for you.""}"
https://www.saatva.com/bedding/heavyweight-comforter,Heavyweight Down Alternative Comforter,An ultra-warm version of our comforter/duvet insert for your coziest sleep,bedding,,0,"{'comforters_king_percale': 395, 'comforters_king_down+alternative': 395, 'comforters_king_organic+cotton': 395, 'comforters_queen_percale': 345, 'comforters_queen_down+alternative': 345, 'comforters_queen_organic+cotton': 345, 'comforters_full_percale': 345, 'comforters_full_down+alternative': 345, 'comforters_full_organic+cotton': 345, 'comforters_twin_percale': 265, 'comforters_twin_down+alternative': 265, 'comforters_twin_organic+cotton': 265, 'comforters_cal+king_percale': 395, 'comforters_cal+king_down+alternative': 395, 'comforters_cal+king_organic+cotton': 395, 'comforters_twin+xl_percale': 265, 'comforters_twin+xl_down+alternative': 265, 'comforters_twin+xl_organic+cotton': 265}","{'product_info': ""Heavyweight Down Alternative Comforter\nAn ultra-warm version of our comforter/duvet insert for your coziest sleep\nWe’re the best reviewed sleep brand since 2010\n$265\nSELECT SIZE\nSize guide\nQTY\nSelect Size\n[object Object]\n[object Object]\n[object Object]\nTwin/Twin XL\n$265\nFull/Queen\nKing/Cal King\n$395\nSelect Quantity\n1\n2\n3\n4\n5\n1\n4\n5\nGreat for colder nights, our heavyweight comforter offers the same luxurious, breathable feel of the original, but with a heavier fill for extra warmth.\nCotton shell made of the finest quality long staple percale cotton\nOEKO-TEX® Standard 100 certified free of harmful chemicals so it's better for you & the planet\nBlend of cloud-like 3D down alternative fiber and naturally moisture-wicking, temperature-regulating lyocell fill\n100% hypoallergenic\nDiamond quilting ensures the down alternative fill stays evenly distributed\nCorner loops to attach inside a duvet cover (sold separately)\nMachine wash cold with like colors, gentle cycle, no bleach, tumble dry low\nFor a medium-weight comforter that’s great for all seasons, check out our All-Year Down Alternative Comforter\nSubtotal\n$265\nAdd 1 Item to Cart\nClose Modal\n\nBed Bonanza\nBIG Bedroom Bonanza Sale! 3 DAYS ONLY | Save up to $600 | Ends 8/3 | Learn More\n45-day free returns\nLearn More\nFree shipping\nLearn More\n1-year limited warranty\nLearn More"", 'fabric_info': ""What makes our heavyweight down alternative comforter so special?\nBREATHABLE PERCALE COTTON SHELL\nOur cotton shell is made with 200-thread count percale weave that’s as breathable as it is durable.\nHEALTHIER SLEEP\nThis product has been OEKO-TEX® Standard 100 certified to guarantee that it’s free of harmful chemicals.\nKEEPS YOU WARM WITHOUT OVERHEATING\nOur heavyweight comforter has a heavier fill and cotton fabric weight, making this our thickest, warmest comforter yet. It has the same breathable blend of recycled down alternative fibers and natural, renewable lyocell fill as our other comforters to keep it nice and breathable.\n100% HYPOALLERGENIC\nSensitive sleepers can rest easy with our comforters' naturally hypoallergenic materials. The addition of natural lyocell in the fill makes it superbly moisture-wicking and breathable.""}"
https://www.saatva.com/bedding/silk-eye-mask,Silk Eye Mask,Blocks out light for restful sleep while protecting the delicate skin around the eyes,bedding,,0,{'eye+masks_None_None': 60},"{'product_info': 'Silk Eye Mask\nBlocks out light for restful sleep while protecting the delicate skin around the eyes\nWe’re the best reviewed sleep brand since 2010\n$60\nQTY\nSelect Quantity\n1\n2\n3\n4\n5\n1\n4\n5\nSELECT COLOR\nSand\nDrift into dreamland with our sleep-enhancing eye mask made of the finest quality mulberry silk. It keeps light out for more uninterrupted sleep—no matter where you are.\nLong fiber mulberry silk cover\nNaturally hypoallergenic, breathable, and temperature regulating\nLuxuriously smooth silk prevents creases and protects the delicate eye area from friction\nSecure elastic headband covered in silk\nPolyester fiber fill\nHand wash with mild detergent and lay flat to dry\nFor calming, therapeutic relief for tired eyes, check out our Weighted Silk Eye Mask\nSubtotal\n$60\nAffirm As low as 0% APR on orders $149+ Learn More\nAdd 1 Item to Cart\nClose Modal\n\nBed Bonanza\nBIG Bedroom Bonanza Sale! 3 DAYS ONLY | Save up to $600 | Ends 8/3 | Learn More\n45-day free returns\nLearn More\nFree shipping\nLearn More\n1-year limited warranty\nLearn More', 'fabric_info': 'What makes our silk eye mask a sleep essential?\n100% PURE MULBERRY SILK\nMulberry silk is regarded as the highest quality silk in the world. Ours is made up of long fibers to give it a more refined feel. It also contains natural proteins and amino acids that help soothe the delicate skin around the eyes\nNATURALLY BREATHABLE\nSilk is naturally breathable and moisture-wicking, yet it also insulates the skin to prevent moisture loss. Its silky, frictionless surface keeps your skincare products on your skin and away from your pillowcase.\nSMOOTH YET DURABLE\nWe chose 22 momme silk for its perfect balance of durability and smooth hand feel. “Momme” is the unit used to describe the weight of silk thread.\nSILKY-SOFT FEEL\nExtra-smooth charmeuse weave lends an extra luxurious feel to the fabric. It creates a frictionless surface to prevent wrinkles and creases on the skin.'}"
https://www.saatva.com/bedding/weighted-silk-eye-mask,Weighted Silk Eye Mask,"Like a calming, sleep-enhancing weighted blanket for tired eyes ",bedding,,0,{'eye+masks_None_None': 75},"{'product_info': 'Weighted Silk Eye Mask\nLike a calming, sleep-enhancing weighted blanket for tired eyes\nWe’re the best reviewed sleep brand since 2010\n$75\nQTY\nSelect Quantity\n1\n2\n3\n4\n5\n1\n4\n5\nSELECT COLOR\nSand\nDrift into dreamland with our sleep-enhancing weighted eye mask made of the finest quality mulberry silk. It blocks out light for more restful sleep as it gives your eyes the calming, therapeutic effect of deep pressure stimulation.\nLong fiber mulberry silk cover\nNaturally hypoallergenic, breathable, and temperature regulating\nLuxuriously smooth silk prevents creases and protects the delicate eye area from friction\nSecure elastic headband covered in silk\nAll-natural glass beads in a baffled internal design provide gentle, even pressure\nHand wash with mild detergent and lay flat to dry\nLooking for a non-weighted version? Check out our Silk Eye Mask\nSubtotal\n$75\nAffirm As low as 0% APR on orders $149+ Learn More\nAdd 1 Item to Cart\nClose Modal\n\nBed Bonanza\nBIG Bedroom Bonanza Sale! 3 DAYS ONLY | Save up to $600 | Ends 8/3 | Learn More\n45-day free returns\nLearn More\nFree shipping\nLearn More\n1-year limited warranty\nLearn More', 'fabric_info': 'What makes our weighted silk eye mask a sleep essential?\n100% PURE MULBERRY SILK\nMulberry silk is regarded as the highest quality silk in the world. Ours is made up of long fibers to give it a more refined feel. It also contains natural proteins and amino acids that help soothe the delicate skin around the eyes\nNATURALLY BREATHABLE\nSilk is naturally breathable and moisture-wicking, yet it also insulates the skin to prevent moisture loss. Its silky, frictionless surface keeps your skincare products on your skin and away from your pillowcase.\nSMOOTH YET DURABLE\nWe chose 22 momme silk for its perfect balance of durability and smooth hand feel. “Momme” is the unit used to describe the weight of silk thread.\nSILKY-SOFT FEEL\nExtra-smooth charmeuse weave lends an extra luxurious feel to the fabric. It creates a frictionless surface to prevent wrinkles and creases on the skin.'}"
https://www.saatva.com/bedding/organic-cotton-sheets,Organic Sateen Sheet Set,Organic cotton sheets with a timeless elegance,bedding,4.7,31,"{'sheets+type_king_sateen': 265, 'sheets+type_king_organic+cotton': 265, 'sheets+type_queen_sateen': 245, 'sheets+type_queen_organic+cotton': 245, 'sheets+type_full_sateen': 225, 'sheets+type_full_organic+cotton': 225, 'sheets+type_twin_sateen': 175, 'sheets+type_twin_organic+cotton': 175, 'sheets+type_split+king_sateen': 295, 'sheets+type_split+king_organic+cotton': 295, 'sheets+type_cal+king_sateen': 265, 'sheets+type_cal+king_organic+cotton': 265, 'sheets+type_split+cal+king_sateen': 295, 'sheets+type_split+cal+king_organic+cotton': 295, 'sheets+type_twin+xl_sateen': 185, 'sheets+type_twin+xl_organic+cotton': 185}","{'product_info': ""Organic Sateen Sheet Set\nOrganic cotton sheets with a timeless elegance\n4.7 star rating\n31 Reviews\n$245\nSelect styles on sale\nSELECT SIZE\nSize guide\nQTY\nSelect Size\n[object Object]\n[object Object]\n[object Object]\n[object Object]\n[object Object]\n[object Object]\n[object Object]\n[object Object]\n[object Object]\nQueen\n$245\nQueen Upper-Flex\nKing Upper-Flex\n$275\nSelect Quantity\n1\n2\n3\n4\n5\n1\n4\n5\nSELECT COLOR\nWhite\nAdd Extra Sateen Pillowcase Pair\nIt's easy to see why our flagship organic cotton sheet is a bestseller. Its silky-soft, 300 thread count sateen weave is made with 100% certified organic cotton. It's better for the planet and feels indulgently luxurious on you.\n100% GOTS certified organic cotton\nIncludes one flat sheet, one fitted sheet, and two pillowcases\nSplit King set includes two Twin XL fitted sheets\nTwin/Twin XL sets include one pillowcase\nDeep pockets for mattresses up to 16” high\nMachine wash cold with like colors, gentle cycle, no bleach, tumble dry low\nCertifications\nSubtotal\n$245\nAs low as $14/month at 0% APR with Affirm Learn More\nAdd 1 Item to Cart\nClose Modal\n\nBed Bonanza\nBIG Bedroom Bonanza Sale! 3 DAYS ONLY | Save up to $600 | Ends 8/3 | Learn More\n45-day free returns\nLearn More\nFree shipping\nLearn More\n1-year limited warranty\nLearn More"", 'fabric_info': ""What makes our organic sheets so special?\nSILKY-SOFT YET DURABLE\nLong organic cotton fibers, or staples, are woven into silky-soft yet durable sheets that just get softer and more comfortable with every wash.\nJUST THE RIGHT THREAD COUNT\nAs thread counts rise, fabrics become warmer. We chose a thread count of 300 for the perfect balance of softness and breathability.\nMADE WITH FAIR TRADE COTTON\nThis bedding product is made with Fair Trade Certified™ cotton that’s sourced with the most rigorous standards of economic and social responsibility for the farmers. We believe it's the most effective way for us to do the most good every day.\nORGANIC ALL THE WAY\nWe only use GOTS (Global Organic Textile Standard) certified organic cotton. From harvesting to each step of manufacturing, our cotton sheets are organic through and through.""}"
https://www.saatva.com/bedding/banded-percale-sheet-set,Banded Percale Sheet Set,"Crisp, cool percale cotton sheets with stylish detailing",bedding,,0,"{'sheets+type_king_percale': 235, 'sheets+type_king_organic+cotton': 235, 'sheets+type_queen_percale': 215, 'sheets+type_queen_organic+cotton': 215, 'sheets+type_full_percale': 195, 'sheets+type_full_organic+cotton': 195, 'sheets+type_twin_percale': 145, 'sheets+type_twin_organic+cotton': 145, 'sheets+type_split+king_percale': 255, 'sheets+type_split+king_organic+cotton': 255, 'sheets+type_cal+king_percale': 235, 'sheets+type_cal+king_organic+cotton': 235, 'sheets+type_split+cal+king_percale': 255, 'sheets+type_split+cal+king_organic+cotton': 255, 'sheets+type_twin+xl_percale': 165, 'sheets+type_twin+xl_organic+cotton': 165}","{'product_info': ""Banded Percale Sheet Set\nCrisp, cool percale cotton sheets with stylish detailing\nWe’re the best reviewed sleep brand since 2010\n$215\nSELECT SIZE\nSize guide\nQTY\nSelect Size\n[object Object]\n[object Object]\n[object Object]\n[object Object]\n[object Object]\n[object Object]\n[object Object]\nQueen\n$215\nCal King\nSplit King\n$255\nSelect Quantity\n1\n2\n3\n4\n5\n1\n4\n5\nSELECT COLOR\nAsh\nAdd Extra Banded Percale Pillowcase Pair\nIndulge in five-star hotel luxury right in your own bedroom with our banded percale sheets. They’re made from breathable long-staple cotton that gets softer and better with every wash.\n200 thread count long-staple cotton\nRecommended for those who sleep hot\nOEKO-TEX® Standard 100 certified free of harmful chemicals so it's better for you & the planet\nHand-finished 1” contrasting band for an elegant look\nIncludes one flat sheet, one deep fitted sheet, and two pillowcases\nDeep pockets for mattresses up to 16” high\nTwin and Twin XL sets include one pillowcase\nMachine wash cold with like colors, gentle cycle, no bleach, tumble dry low\nThis item is currently out of stock.\nSign up to be notified by email once it comes back\nin stock or call us at 1-877-672-2882\nEmail me when in stock\n\nBed Bonanza\nBIG Bedroom Bonanza Sale! 3 DAYS ONLY | Save up to $600 | Ends 8/3 | Learn More\n45-day free returns\nLearn More\nFree shipping\nLearn More\n1-year limited warranty\nLearn More"", 'fabric_info': ""What makes our banded percale cotton sheets so special?\nLIGHT YET DURABLE\nLong cotton fibers, or staples, are woven into a crisp percale weave that's naturally very breathable, moisture-wicking, and cool to the touch.\nJUST THE RIGHT THREAD COUNT\nAs thread counts rise, fabrics become warmer. We chose a thread count of 200 for the perfect balance of softness and breathability.\nHEALTHIER SLEEP\nWe only use OEKO-TEX® Standard 100 certified cotton to guarantee that our sheets are free of harmful chemicals. Natural cotton is also moisture-wicking and hypoallergenic.\nCLASSIC STYLE\nThe crisp, matte finish of our percale cotton is adorned by a hand-finished 1” band for a refined contrast.""}"
https://www.saatva.com/bedding/down-alternative-comforter,All-Year Down Alternative Comforter,Plush and breathable all-season comforter/duvet insert,bedding,,0,"{'comforters_king_percale': 365, 'comforters_king_down+alternative': 365, 'comforters_king_organic+cotton': 365, 'comforters_queen_percale': 315, 'comforters_queen_down+alternative': 315, 'comforters_queen_organic+cotton': 315, 'comforters_full_percale': 315, 'comforters_full_down+alternative': 315, 'comforters_full_organic+cotton': 315, 'comforters_twin_percale': 235, 'comforters_twin_down+alternative': 235, 'comforters_twin_organic+cotton': 235, 'comforters_cal+king_percale': 365, 'comforters_cal+king_down+alternative': 365, 'comforters_cal+king_organic+cotton': 365, 'comforters_twin+xl_percale': 235, 'comforters_twin+xl_down+alternative': 235, 'comforters_twin+xl_organic+cotton': 235}","{'product_info': 'All-Year Down Alternative Comforter\nPlush and breathable all-season comforter/duvet insert\nWe’re the best reviewed sleep brand since 2010\n$235\nSELECT SIZE\nSize guide\nQTY\nSelect Size\n[object Object]\n[object Object]\n[object Object]\nTwin/Twin XL\n$235\nFull/Queen\nKing/Cal King\n$365\nSelect Quantity\n1\n2\n3\n4\n5\n1\n4\n5\nCuddle up in the plush, airy luxury of our natural cotton comforter with a unique blend of 3D down alternative and sustainable lyocell fill. It keeps you warm and cozy in the winter, but stays nice and breathable in warmer months.\nCotton shell made of the finest quality long staple percale cotton\nBlend of cloud-like 3D down alternative fiber and naturally moisture-wicking lyocell fill\n100% hypoallergenic\nBox quilting ensures the down alternative fill stays evenly distributed\nCorner loops to attach inside a duvet cover (sold separately)\nMachine wash cold with like colors, gentle cycle, no bleach, tumble dry low\nFor a lighter comforter that’s great for warmer climates, check out our Lightweight Down Alternative Comforter.\nSubtotal\n$235\nAs low as $14/month at 0% APR with Affirm Learn More\nAdd 1 Item to Cart\nClose Modal\n\nBed Bonanza\nBIG Bedroom Bonanza Sale! 3 DAYS ONLY | Save up to $600 | Ends 8/3 | Learn More\n45-day free returns\nLearn More\nFree shipping\nLearn More\n1-year limited warranty\nLearn More', 'fabric_info': ""What makes our down alternative comforter so special?\nBREATHABLE PERCALE COTTON SHELL\nOur 100% cotton shell is woven into a 200-thread count percale weave that’s cool, crisp, and airy.\nTEMPERATURE-REGULATING\nA cloud-like blend of 3D down alternative fibers and natural, renewable lyocell fill keeps you cozy during cold nights but stays airy and super breathable.\nETHICALLY SOURCED\nEvery step in crafting our cotton has been guided by our commitment to improving the livelihood of the workers who handcraft our bedding in India.\n100% HYPOALLERGENIC\nSensitive sleepers can rest easy with our comforters' naturally hypoallergenic materials. The addition of natural lyocell in the fill makes it superbly moisture-wicking and breathable.""}"
https://www.saatva.com/bedding/waffle-knit-duvet-cover-set,Waffle Knit Duvet Cover Set,Plush yet lightweight duvet cover and shams with elegant texture,bedding,,0,"{'duvet+covers_king_organic+cotton': 295, 'duvet+covers_queen_organic+cotton': 275, 'duvet+covers_full_organic+cotton': 275, 'duvet+covers_twin_organic+cotton': 225, 'duvet+covers_cal+king_organic+cotton': 295, 'duvet+covers_twin+xl_organic+cotton': 225}","{'product_info': 'NEW\nWaffle Knit Duvet Cover Set\nPlush yet lightweight duvet cover and shams with elegant texture\nWe’re the best reviewed sleep brand since 2010\n$225\nSELECT SIZE\nSize guide\nQTY\nSelect Size\n[object Object]\n[object Object]\n[object Object]\nTwin/Twin XL\n$225\nFull/Queen\nKing/CalKing\n$295\nSelect Quantity\n1\n2\n3\n4\n5\n1\n4\n5\nSELECT COLOR\nWhite\nAdd Extra Waffle Knit Sham Pair\nDive into the undeniably plush and airy comfort of our waffle weave duvet cover and matching shams.\n100% long staple cotton gets softer with every wash\nWaffle weave with 200 thread count percale cotton backing\nOEKO-TEX® Standard 100 certified to be free of potentially harmful chemicals\nIncludes one duvet cover and two pillow shams\nTwin and Twin XL sets include one pillow sham\n1” flanged edge detail for an elegant look\nHidden zipper closure on the duvet cover and center envelope opening on shams\nCorner ties keep your comforter/duvet insert (sold separately) in place\nMachine wash cold with like colors, gentle cycle, no bleach, do not wash with hot water and heavy loads, tumble dry low, low iron if needed\nSubtotal\n$225\nAs low as $13/month at 0% APR with Affirm Learn More\nAdd 1 Item to Cart\nClose Modal\n\nBed Bonanza\nBIG Bedroom Bonanza Sale! 3 DAYS ONLY | Save up to $600 | Ends 8/3 | Learn More\n45-day free returns\nLearn More\nFree shipping\nLearn More\n1-year limited warranty\nLearn More', 'product_value': 'What makes our waffle knit duvet cover sets so special?\nPlush yet lightweight\nClassic waffle weave offers a soft, springy feel that’s cozy yet airy and adds an elegant dose of texture to any bedroom.\nHealthier sleep\nThis product has been OEKO-TEX® Standard 100 certified to guarantee that it’s free of harmful chemicals.\nTemperature regulating\nThick, three-dimensional outline of the weave helps to retain warmth for a cozy feel, while square pockets allow air to circulate for maximum breathability, even in warmer months.\nJust the right thread count\nAs thread counts rise, fabrics become warmer. The percale cotton backing has a thread count of 200 for the perfect balance of softness and breathability.'}"
https://www.saatva.com/bedding/waffle-towels,Waffle Towel Collection,Our light & airy towel inspired by the world’s finest spas,bedding,,0,{'towels_None_None': 175},"{'product_info': ""NEW\nWaffle Towel Collection\nOur light & airy towel inspired by the world’s finest spas\nWe’re the best reviewed sleep brand since 2010\n$95\nSELECT BATH SET\nSize guide\n3-piece\n Bath Towel Set\n4-pack\n Bath Towels\n2-pack\n Bath Sheets\nWhat's included:\n1 bath towel, 1 hand towel, 1 face towel\nSELECT COLOR\nWhite\nEnjoy spa-worthy softness after every bath or shower with our light & breathable waffle towels. Exclusively woven in durable long staple cotton that gets softer with every wash.\nLong staple cotton woven in a lightweight & ultra-absorbent oversized waffle construction\nOEKO-TEX® Standard 100 certified free of harmful chemicals so it's better for you & the planet\nComes in a natural cotton drawstring bag for storage (and perfect for gifting!)\nMachine wash warm with like-color towels (not mixed with clothing), in gentle cycle, no bleach, tumble dry in low or medium heat\nWe recommend hanging your waffle towel on a rack instead of hooks to maintain the waffle weave structure over time\nSubtotal\n$95\nAffirm As low as 0% APR on orders $149+ Learn More\nAdd 1 Item to Cart\nClose Modal\n\nBed Bonanza\nBIG Bedroom Bonanza Sale! 3 DAYS ONLY | Save up to $600 | Ends 8/3 | Learn More\n45-day free returns\nLearn More\nFree shipping\nLearn More\n1-year limited warranty\nLearn More"", 'product_value': 'What makes our Waffle Towel Collection so special?\nBreathable yet absorbent\nFeatures an Imabari-style waffle design for a lightweight feel that doesn’t sacrifice absorbency and softness.\nWoven with durable long staple cotton\nLong staple cotton yarns get softer with every wash and will last for years with proper care.\nBetter for you & the planet\nOEKO-TEX® Standard 100 certified cotton guarantees that our towels are free of harmful chemicals.', 'towel_info': '3-piece\n Bath Towel Set\n4-pack\n Bath Towels\n2-pack\n Bath Sheets'}"
